{
  "schemaVersion": 1,
  "academicYear": 2026,
  "timezone": "Asia/Tokyo",
  "source": [
    {
      "id": "official-graduate-2026-3q",
      "title": "Science Tokyo graduate timetable source (2026 3Q pending publication)",
      "url": "https://www.titech.ac.jp/student/pdf/life-graduate-exam-timetable.pdf",
      "landingPageUrl": "https://www.titech.ac.jp/student/students/life/graduate-exam"
    }
  ],
  "entries": []
}
